results/model/model_results.json

{
    "random_forest": {
        "train_rmse": 4.474932447233198,
        "test_rmse": 7.806602416771463,
        "test_mae": 5.024481179365696,
        "test_r2": 0.9459833106077822,
        "hyperparams": {
            "n_estimators": 290,
            "max_depth": 10,
            "min_samples_split": 5,
            "min_samples_leaf": 1
        }
    },
    "extra_trees": {
        "train_rmse": 3.512293660474934,
        "test_rmse": 8.167517376661229,
        "test_mae": 4.758111895595099,
        "test_r2": 0.9408732545920819,
        "hyperparams": {
            "n_estimators": 126,
            "max_depth": 13,
            "min_samples_split": 5,
            "min_samples_leaf": 2
        }
    },
    "xgboost": {
        "train_rmse": 3.6701818929767285,
        "test_rmse": 6.668622679390362,
        "test_mae": 3.975838211777551,
        "test_r2": 0.9605836750042518,
        "hyperparams": {
            "max_depth": 5,
            "learning_rate": 0.019434277714494578,
            "n_estimators": 337,
            "subsample": 0.6432635459418835,
            "colsample_bytree": 0.8596878333903372,
            "min_child_weight": 2,
            "gamma": 0.8684330334280612,
            "reg_lambda": 0.34817508259899915,
            "reg_alpha": 0.35107442954920937,
            "random_state": 42,
            "n_jobs": -1
        }
    }
}

README.md

### Hyperparameters tối ưu (Optuna):

- max_depth: 5
- learning_rate: 0.0194
- n_estimators: 337
- subsample: 0.643
- colsample_bytree: 0.860
- min_child_weight: 2
- gamma: 0.868
- reg_lambda: 0.348
- reg_alpha: 0.351